bookID,title,authors,average_rating,isbn,isbn13,language_code,  num_pages,ratings_count,text_reviews_count,publication_date,publisher
2,Harry Potter and the Order of the Phoenix (Harry Potter  #5),J.K. Rowling/Mary GrandPr,4.49,439358078,9.78E+12,eng,870,2153167,29221,9/1/2004,Scholastic Inc.
4,Harry Potter and the Chamber of Secrets (Harry Potter  #2),J.K. Rowling,4.42,439554896,9.78E+12,eng,352,6333,244,11/1/2003,Scholastic
5,Harry Potter and the Prisoner of Azkaban (Harry Potter  #3),J.K. Rowling/Mary GrandPr,4.56,043965548X,9.78E+12,eng,435,2339585,36325,5/1/2004,Scholastic Inc.
8,Harry Potter Boxed Set  Books 1-5 (Harry Potter  #1-5),J.K. Rowling/Mary GrandPr,4.78,439682584,9.78E+12,eng,2690,41428,164,9/13/2004,Scholastic
9,"Unauthorized Harry Potter Book Seven News: ""Half-Blood Prince"" Analysis and Speculation",W. Frederick Zimmerman,3.74,976540606,9.78E+12,en-US,152,19,1,4/26/2005,Nimble Books
10,Harry Potter Collection (Harry Potter  #1-6),J.K. Rowling,4.73,439827604,9.78E+12,eng,3342,28242,808,9/12/2005,Scholastic
12,The Ultimate Hitchhiker's Guide: Five Complete Novels and One Story (Hitchhiker's Guide to the Galaxy  #1-5),Douglas Adams,4.38,517226952,9.78E+12,eng,815,3628,254,11/1/2005,Gramercy Books
13,The Ultimate Hitchhiker's Guide to the Galaxy (Hitchhiker's Guide to the Galaxy  #1-5),Douglas Adams,4.38,345453743,9.78E+12,eng,815,249558,4080,4/30/2002,Del Rey Books
14,The Hitchhiker's Guide to the Galaxy (Hitchhiker's Guide to the Galaxy  #1),Douglas Adams,4.22,1400052920,9.78E+12,eng,215,4930,460,8/3/2004,Crown
16,The Hitchhiker's Guide to the Galaxy (Hitchhiker's Guide to the Galaxy  #1),Douglas Adams/Stephen Fry,4.22,739322206,9.78E+12,eng,6,1266,253,3/23/2005,Random House Audio
18,The Ultimate Hitchhiker's Guide (Hitchhiker's Guide to the Galaxy  #1-5),Douglas Adams,4.38,517149257,9.78E+12,eng,815,2877,195,1/17/1996,Wings Books
21,A Short History of Nearly Everything,Bill Bryson,4.21,076790818X,9.78E+12,eng,544,248558,9396,9/14/2004,Broadway Books
22,Bill Bryson's African Diary,Bill Bryson,3.44,767915062,9.78E+12,eng,55,7270,499,12/3/2002,Broadway Books
23,Bryson's Dictionary of Troublesome Words: A Writer's Guide to Getting It Right,Bill Bryson,3.87,767910435,9.78E+12,eng,256,2088,131,9/14/2004,Broadway Books
24,In a Sunburned Country,Bill Bryson,4.07,767903862,9.78E+12,eng,335,72451,4245,5/15/2001,Broadway Books
25,I'm a Stranger Here Myself: Notes on Returning to America After Twenty Years Away,Bill Bryson,3.9,076790382X,9.78E+12,eng,304,49240,2211,6/28/2000,Broadway Books
26,The Lost Continent: Travels in Small Town America,Bill Bryson,3.83,60920084,9.78E+12,eng,299,45712,2257,8/28/1990,William Morrow Paperbacks
27,Neither Here nor There: Travels in Europe,Bill Bryson,3.86,380713802,9.78E+12,eng,254,48701,2238,3/28/1993,William Morrow Paperbacks
28,Notes from a Small Island,Bill Bryson,3.91,380727501,9.78E+12,eng,324,80609,3301,5/28/1997,William Morrow Paperbacks
29,The Mother Tongue: English and How It Got That Way,Bill Bryson,3.93,380715430,9.78E+12,eng,270,28489,2085,9/28/1991,William Morrow Paperbacks
30,J.R.R. Tolkien 4-Book Boxed Set: The Hobbit and The Lord of the Rings,J.R.R. Tolkien,4.59,345538374,9.78E+12,eng,1728,101233,1550,9/25/2012,Ballantine Books
31,The Lord of the Rings (The Lord of the Rings  #1-3),J.R.R. Tolkien,4.5,618517650,9.78E+12,eng,1184,1710,91,10/21/2004,Houghton Mifflin Harcourt
34,The Fellowship of the Ring (The Lord of the Rings  #1),J.R.R. Tolkien,4.36,618346252,9.78E+12,eng,398,2128944,13670,9/5/2003,Houghton Mifflin Harcourt
35,The Lord of the Rings (The Lord of the Rings  #1-3),J.R.R. Tolkien/Alan  Lee,4.5,618260587,9.78E+12,en-US,1216,1618,140,10/1/2002,Houghton Mifflin Harcourt
36,The Lord of the Rings: Weapons and Warfare,Chris   Smith/Christopher  Lee/Richard Taylor,4.53,618391002,9.78E+12,eng,218,19822,46,11/5/2003,Houghton Mifflin Harcourt
37,The Lord of the Rings: Complete Visual Companion,Jude Fisher,4.5,618510826,9.78E+12,eng,224,359,6,11/15/2004,Houghton Mifflin Harcourt
45,Agile Web Development with Rails: A Pragmatic Guide,Dave Thomas/David Heinemeier Hansson/Leon Breedt/Mike Clark/Thomas  Fuchs/Andreas  Schwarz,3.84,097669400X,9.78E+12,eng,558,1430,59,7/28/2005,Pragmatic Bookshelf
50,Hatchet (Brian's Saga  #1),Gary Paulsen,3.72,689840926,9.78E+12,eng,208,270244,12017,4/1/2000,Atheneum Books for Young Readers: Richard Jackson Books
51,"Hatchet: A Guide for Using ""Hatchet"" in the Classroom",Donna Ickes/Edward Sciranko/Keith Vasconcelles,4,1557344493,9.78E+12,eng,48,36,2,8/28/1994,Teacher Created Resources
53,Guts: The True Stories behind Hatchet and the Brian Books,Gary Paulsen,3.88,385326505,9.78E+12,eng,144,2067,334,1/23/2001,Delacorte Press
54,Molly Hatchet - 5 of the Best,Molly Hatchet,4.33,1575606240,9.78E+12,eng,56,6,0,6/10/2003,Cherry Lane Music Company
55,Hatchet Jobs: Writings on Contemporary Fiction,Dale Peck,3.45,1595580271,9.78E+12,en-US,228,99,16,11/1/2005,The New Press
57,A Changeling for All Seasons (Changeling Seasons #1),Angela Knight/Sahara Kelly/Judy Mays/Marteeka Karland/Kate Douglas/Shelby Morgen/Lacey Savage/Kate Hill/Willa Okati,3.76,1595962808,9.78E+12,eng,304,167,4,11/1/2005,Changeling Press
58,Changeling (Changeling  #1),Delia Sherman,3.6,670059676,9.78E+12,eng,256,978,111,8/17/2006,Viking Juvenile
59,The Changeling Sea,Patricia A. McKillip,4.06,141312629,9.78E+12,eng,137,4454,302,4/14/2003,Firebird
61,The Changeling,Zilpha Keatley Snyder,4.17,595321801,9.78E+12,eng,228,1176,96,6/8/2004,iUniverse
63,The Changeling,Kate Horsley,3.55,1590301943,9.78E+12,eng,339,301,43,4/12/2005,Shambhala
66,The Changeling (Daughters of England  #15),Philippa Carr,3.98,449146979,9.78E+12,eng,369,345,12,8/28/1990,Ivy Books
67,The Known World,Edward P. Jones,3.83,61159174,9.78E+12,eng,388,29686,2626,8/29/2006,Amistad
68,The Known World,Edward P. Jones/Kevin R. Free,3.83,006076273X,9.78E+12,en-US,14,55,12,6/15/2004,HarperAudio
69,The Known World,Edward P. Jones,3.83,60749911,9.78E+12,eng,576,22,3,6/15/2004,Harper
71,Traders  Guns & Money: Knowns and Unknowns in the Dazzling World of Derivatives,Satyajit Das,3.83,273704745,9.78E+12,eng,334,1456,82,5/15/2006,FT Press
72,Artesia: Adventures in the Known World,Mark Smylie,4.13,1932386106,9.78E+12,eng,352,52,4,12/14/2005,Archaia
74,The John McPhee Reader (John McPhee Reader  #1),John McPhee/William Howarth,4.42,374517193,9.78E+12,eng,416,562,37,6/1/1982,Farrar  Straus and Giroux
75,Uncommon Carriers,John McPhee,3.95,374280398,9.78E+12,en-US,248,1630,203,5/16/2006,Farrar Straus Giroux
76,Heirs of General Practice,John McPhee,4.17,374519749,9.78E+12,eng,128,268,22,4/1/1986,Farrar  Straus and Giroux
77,The Control of Nature,John McPhee,4.24,374522596,9.78E+12,en-US,288,3498,305,9/1/1990,Farrar  Straus and Giroux
78,Annals of the Former World,John McPhee,4.34,374518734,9.78E+12,eng,720,3115,228,1/6/1999,Farrar  Straus and Giroux
79,Coming Into the Country,John McPhee,4.22,374522871,9.78E+12,eng,448,5704,261,4/1/1991,Farrar  Straus and Giroux
80,La Place de la Concorde Suisse,John McPhee,3.92,374519323,9.78E+12,fre,160,698,52,4/1/1994,Farrar  Straus and Giroux
81,Giving Good Weight,John McPhee,4.23,374516006,9.78E+12,eng,288,542,36,4/1/1994,Farrar  Straus and Giroux
83,Rising from the Plains,John McPhee,4.23,374520658,9.78E+12,eng,208,1341,98,11/1/1987,Farrar  Straus and Giroux
85,The Heidi Chronicles,Wendy Wasserstein,3.75,822205106,9.78E+12,eng,81,1423,70,3/1/2002,Dramatists Play Service
86,The Heidi Chronicles: Uncommon Women and Others & Isn't It Romantic,Wendy Wasserstein,3.84,679734996,9.78E+12,eng,249,2766,64,7/2/1991,Vintage
89,Active Literacy Across the Curriculum: Strategies for Reading  Writing  Speaking  and Listening,Heidi Hayes Jacobs,3.94,1596670231,9.78E+12,eng,138,31,1,3/29/2006,Routledge
90,Simply Beautiful Beaded Jewelry,Heidi Boyd,3.77,1581807740,9.78E+12,en-US,128,62,4,3/14/2006,North Light Books
91,Always Enough: God's Miraculous Provision Among the Poorest Children on Earth,Heidi Baker/Rolland Baker,4.46,800793617,9.78E+12,eng,192,860,53,9/1/2003,Chosen Books
92,Mapping the Big Picture: Integrating Curriculum & Assessment K-12,Heidi Hayes Jacobs,3.68,871202867,9.78E+12,en-US,108,77,2,1/28/1997,Association for Supervision & Curriculum Development
93,Heidi (Heidi  #1-2),Johanna Spyri/Beverly Cleary/Angelo  Rinaldi,3.99,753454947,9.78E+12,eng,352,153317,2257,11/15/2002,Kingfisher
94,Getting Results with Curriculum Mapping,Heidi Hayes Jacobs,3.25,871209993,9.78E+12,eng,192,55,5,11/15/2004,ASCD
96,There's Always Enough: The Miraculous Move of God in Mozambique,Rolland Baker/Heidi Baker,4.46,1852402873,9.78E+12,eng,192,34,6,4/28/2003,Sovereign World
98,What to Expect the First Year (What to Expect),Heidi Murkoff/Sharon Mazel/Arlene Eisenberg/Sandee Hathaway/Mark D. Widome,3.89,761129588,9.78E+12,eng,832,11797,659,10/16/2003,Workman Publishing Company
99,The Player's Handbook: The Ultimate Guide on Dating and Relationships,Heidi Fleiss/Libby Keatinge,3.82,972016414,9.78E+12,eng,123,34,8,5/10/2004,One Hour Entertainment
100,Simply Beautiful Beading: 53 Quick and Easy Projects,Heidi Boyd,3.78,1581805632,9.78E+12,en-US,128,78,4,8/19/2004,North Light Books
103,God Emperor of Dune (Dune Chronicles  #4),Frank Herbert,3.84,441294677,9.78E+12,eng,423,2785,166,6/15/1987,Ace Books
105,Chapterhouse: Dune (Dune Chronicles #6),Frank Herbert,3.91,441102670,9.78E+12,eng,436,38778,568,7/1/1987,Ace Books
106,Dune Messiah (Dune Chronicles #2),Frank Herbert,3.88,441172695,9.78E+12,eng,331,97494,2359,7/15/1987,Ace Books
107,Dreamer of Dune: The Biography of Frank Herbert,Brian Herbert,4.01,765306476,9.78E+12,en-US,592,784,21,7/1/2004,Tor Books
109,Heretics of Dune (Dune Chronicles  #5),Frank Herbert,3.86,399128980,9.78E+12,eng,480,272,20,4/16/1984,Putnam
110,The Road to Dune,Frank Herbert/Brian Herbert/Kevin J. Anderson,3.88,765353709,9.78E+12,eng,426,4789,83,8/29/2006,Tor Science Fiction
117,Heretics of Dune (Dune Chronicles #5),Frank Herbert,3.86,441328008,9.78E+12,eng,471,45388,644,8/15/1987,Ace Books
119,The Lord of the Rings: The Art of the Fellowship of the Ring,Gary Russell,4.59,618212906,9.78E+12,eng,192,26153,102,6/12/2002,Houghton Mifflin Harcourt
122,The Power of One (The Power of One  #1),Bryce Courtenay,4.35,034541005X,9.78E+12,eng,544,69167,4551,9/29/1996,Ballantine Books
123,The Power of One (The Power of One  #1),Bryce Courtenay,4.35,385732546,9.78E+12,eng,291,45,13,9/13/2005,Delacorte Books for Young Readers
129,The Power of One: One Person  One Rule  One Month,John C. Maxwell/Stephen R. Graves/Thomas G. Addington,4.28,785260056,9.78E+12,en-US,256,16,1,11/1/2004,Thomas Nelson
130,Power of an Hour: Business and Life Mastery in One Hour a Week,Dave Lakhani,3.34,471780936,9.78E+12,eng,205,174,16,5/19/2006,Wiley
131,The Power of One: The Solo Play for Playwrights  Actors  and Directors,Louis E. Catron,3.67,325001537,9.78E+12,eng,240,10,0,2/7/2000,Heinemann Drama
132,How to Buy  Sell & Profit on eBay: Kick-Start Your Home-Based Business in Just Thirty Days,Adam Ginsberg,3.48,006076287X,9.78E+12,eng,336,76,9,5/3/2005,William Morrow Paperbacks
133,eBay for Dummies,Marsha Collier,3.5,470045299,9.78E+12,eng,386,111,9,10/30/2006,Wiley
135,What to Sell on ebay and Where to Get It: The Definitive Guide to Product Sourcing for eBay and Beyond,Chris Malta/Lisa Suttora,3.62,72262788,9.78E+12,eng,260,24,0,1/24/2006,McGraw-Hill
137,Starting an eBay Business for Dummies,Marsha Collier,3.55,764569244,9.78E+12,eng,384,55,4,9/17/2004,Wiley
138,eBay: Top 100 Simplified Tips & Tricks,Julia Wilkinson,4.27,471933821,9.78E+12,eng,260,9,0,6/6/2006,Wiley
139,ebay Timesaving Techniques for Dummies,Marsha Collier,3.39,764559915,9.78E+12,en-US,391,22,1,5/31/2004,Wiley
140,eBay Business All-in-One Desk Reference for Dummies,Marsha Collier,3.89,764584383,9.78E+12,en-US,864,17,3,4/25/2005,Wiley
141,Ruby Cookbook,Lucas Carlson/Leonard Richardson,3.84,596523696,9.78E+12,eng,873,166,4,7/29/2006,O'Reilly Media
142,Ruby Ann's Down Home Trailer Park Cookbook,Ruby Ann Boxcar,4.12,806523492,9.78E+12,eng,240,50,5,5/3/2005,Citadel
144,Ruby Ann's Down Home Trailer Park BBQin' Cookbook,Ruby Ann Boxcar,4.08,806525363,9.78E+12,eng,206,13,2,5/3/2005,Citadel
147,Rails Cookbook: Recipes for Rapid Web Development with Ruby,Rob Orsini,3.48,596527314,9.78E+12,eng,514,64,1,1/1/2007,O'Reilly Media
151,Anna Karenina,Leo Tolstoy/Richard Pevear/Larissa Volokhonsky,4.05,143035002,9.78E+12,eng,838,16643,1851,5/31/2004,Penguin Classics
152,Anna Karenina,Leo Tolstoy/David Magarshack/Priscilla Meyer,4.05,451528611,9.78E+12,eng,960,109420,5696,11/5/2002,Signet
153,Anna Karenina,Leo Tolstoy/Richard Pevear/Larissa Volokhonsky/John Bayley,4.05,140449175,9.78E+12,eng,837,2904,309,1/30/2003,Penguin Books
154,CliffsNotes on Tolstoy's Anna Karenina,Marianne Sturman/Leo Tolstoy,3.85,822001837,9.78E+12,eng,80,16,3,11/26/1965,Cliffs Notes
155,Anna Karenina,Leo Tolstoy/Amy Mandelker/Constance Garnett,4.05,1593080271,9.78E+12,eng,803,9564,726,7/1/2003,Barnes & Noble Classics
156,Anna Karenina,Leo Tolstoy/Louise Maude/Aylmer Maude,4.05,486437965,9.78E+12,eng,752,474,72,11/23/2004,Dover Publications
157,Anna Karenina,Leo Tolstoy/Constance Garnett/Amy Mandelker,4.05,1593081774,9.78E+12,eng,803,303,48,8/26/2004,Barnes & Noble
159,Dinner with Anna Karenina,Gloria Goldreich,2.99,778322270,9.78E+12,eng,360,411,65,1/28/2006,Mira Books
160,Tolstoy: Anna Karenina,Anthony Thorlby,4.19,521313252,9.78E+12,eng,128,1204,33,11/26/1987,Cambridge University Press
162,Untouchable,Mulk Raj Anand/E.M. Forster,3.71,140183957,9.78E+12,eng,160,3429,279,7/3/1990,Penguin Books
163,The Untouchable,John Banville,3.95,679767479,9.78E+12,eng,367,2163,216,6/30/1998,Vintage
164,The Untouchables,Eliot Ness/Oscar Fraley,3.89,1568491980,9.78E+12,eng,256,613,31,2/1/1996,Buccaneer Books
165,Untouchables: My Family's Triumphant Journey Out of the Caste System in Modern India,Narendra Jadhav,3.82,743270797,9.78E+12,en-US,320,308,40,9/27/2005,Scribner
166,Dalit: The Black Untaouchables of India,V.T. Rajshekar/Y.N. Kly,4.2,932863051,9.78E+12,eng,100,10,0,1/28/1995,Clarity Press
168,Growing Up Untouchable in India: A Dalit Autobiography,Vasant Moon/Gail Omvedt/Eleanor Zelliot,3.65,742508803,9.78E+12,eng,224,16,4,12/20/2000,Rowman & Littlefield Publishers
171,The Evidence-Based Social Work Skills Book,Barry R. Cournoyer,3.4,205358624,9.78E+12,eng,216,10,0,9/22/2003,Pearson
177,"A Wrinkle in Time: A Guide for Using ""A Wrinkle in Time"" in the Classroom",John Carratello/Patty Carratello/Theresa Wright,4,1557344035,9.78E+12,eng,48,17,0,9/28/1991,Teacher Created Resources
180,Wrinkles in Time,George Smoot/Keay Davidson,4.01,380720442,9.78E+12,eng,360,1035,23,10/1/1994,Harper Perennial
181,A Wrinkle in Time: With Related Readings (A Wrinkle in Time Quintet #1),Madeleine L'Engle,4,821925326,9.78E+12,eng,250,36,6,5/1/2002,EMC/Paradigm Publishing
182,Literature Circle Guide: A Wrinkle in Time,Tara MacCarthy,3.6,043927169X,9.78E+12,eng,32,15,0,1/1/2002,Teaching Resources
201,Una arruga en el tiempo – A Wrinkle in Time,Madeleine L'Engle,4,606105263,9.78E+12,spa,205,6,1,6/1/1984,Turtleback Books
204,The Long Shadow (The Morland Dynasty  #6),Cynthia Harrod-Eagles,4.12,751506435,9.78E+12,eng,367,376,17,6/1/1994,Little  Brown Book Group
205,A Long Shadow (Inspector Ian Rutledge  #8),Charles Todd,4.11,006078671X,9.78E+12,eng,352,3086,237,1/3/2006,William Morrow
207,Long Way Round: Chasing Shadows Across the World,Ewan McGregor/Charley Boorman/Robert Uhlig,3.94,743499344,9.78E+12,en-US,320,352,44,11/1/2005,Atria Books
208,A Shadow in Summer (Long Price Quartet  #1),Daniel Abraham,3.6,765313405,9.78E+12,eng,331,9852,633,3/7/2006,Tor Books
213,New Hope for the Dead (Hoke Mosely #2),Charles Willeford/James Lee Burke,3.9,1400032490,9.78E+12,eng,244,821,78,8/10/2004,Vintage Crime/Black Lizard
214,Sideswipe: A Hoke Moseley Novel,Charles Willeford/Lawrence Block,4.05,1400032482,9.78E+12,eng,215,731,72,3/8/2005,Vintage Crime/Black Lizard
216,Miami Blues (Hoke Moseley #1),Charles Willeford/Elmore Leonard,3.94,1400032466,9.78E+12,eng,191,2897,178,8/10/2004,Vintage Crime/Black Lizard
230,The Burnt Orange Heresy (Vintage Crime/Black Lizard),Charles Willeford,3.89,679732527,9.78E+12,eng,144,98,11,10/3/1990,Vintage
231,I am Charlotte Simmons,Tom Wolfe,3.42,312424442,9.78E+12,eng,738,20888,1688,8/30/2005,Picador USA
237,Poetry for Young People: Edward Lear,Edward Lear/Laura Huliska-Beith/Edward Mendelson,3.91,806930772,9.78E+12,eng,48,66,19,10/1/2001,Sterling
244,The Puffin Book of Nonsense Verse,Quentin Blake,4.02,140366601,9.78E+12,eng,287,81,6,10/3/1996,Puffin
245,Henry Miller on Writing,Henry Miller/Thomas H. Moore,4.22,811201120,9.78E+12,eng,217,981,52,2/1/1964,New Directions Publishing
247,Quiet Days in Clichy,Henry Miller,3.69,080213016X,9.78E+12,eng,154,3381,141,1/13/1994,Grove Press
249,Tropic of Cancer,Henry Miller/Jiří Níl,3.68,802131786,9.78E+12,eng,318,53206,2376,1/6/1994,Grove Press
250,Tropic of Capricorn,Henry Miller,3.78,802151825,9.78E+12,eng,348,14872,459,1/13/1994,Grove Press
251,Nexus (The Rosy Crucifixion  #3),Henry Miller,4.1,802151787,9.78E+12,eng,316,3261,58,1/13/1994,Grove Press
252,Sexus (The Rosy Crucifixion  #1),Henry Miller,3.98,802151809,9.78E+12,eng,506,7805,251,1/12/1994,Grove Press
253,The Air-Conditioned Nightmare,Henry Miller,3.83,811201066,9.78E+12,eng,292,2699,142,1/17/1970,New Directions
264,The Portrait of a Lady,Henry James/Patricia Crick,3.78,141439637,9.78E+12,eng,797,61640,1951,9/30/2003,Penguin Classics
269,The Portrait of a Lady,Henry James/Gabriel Brownstein/Mary Cregan,3.78,1593080964,9.78E+12,eng,635,392,41,1/16/2004,Barnes  Noble Classics
277,Writing,Marguerite Duras,3.75,1571290532,9.78E+12,eng,91,778,44,5/6/1999,Brookline Books
278,The War,Marguerite Duras/Barbara Bray,3.85,1565842219,9.78E+12,eng,192,963,65,8/1/1994,The New Press
280,The Ravishing of Lol Stein,Marguerite Duras/Richard Seever,3.66,394743040,9.78E+12,en-US,181,2057,128,3/12/1986,Pantheon
285,Love Letters,Kahlil Gibran/Suheil Bushrui/Salma H. Al-Kuzbari,3.68,1851681825,9.78E+12,eng,178,203,8,7/1/1999,One World (UK)
288,Kahlil Gibran: His Life and World,Jean Gibran/Kahlil Gibran,4.21,156656249X,9.78E+12,eng,464,35,2,4/1/1998,Interlink Publishing Group
289,The Beloved: Reflections on the Path of the Heart,Kahlil Gibran/John Walbridge/Robin Waterfield,4.19,014019553X,9.78E+12,eng,102,328,16,1/1/1998,Penguin Books
290,Jesus the Son of Man,Kahlil Gibran,3.98,394431243,9.78E+12,eng,216,1308,82,2/21/1995,Knopf
291,The Broken Wings,Kahlil Gibran/Anthony Rizcallah Ferris,3.92,806501901,9.78E+12,eng,132,6432,517,3/3/2003,Citadel
292,Sand and Foam,Kahlil Gibran,4.08,067943920X,9.78E+12,eng,100,3015,217,6/14/2011,Knopf
295,Treasure Island,Robert Louis Stevenson,3.83,753453800,9.78E+12,eng,311,318753,6734,9/15/2001,Kingfisher
296,Treasure Island,Robert Louis Stevenson/Scott McKowen,3.83,1402714572,9.78E+12,en-US,213,420,42,10/1/2004,Sterling Children's Books
297,Treasure Island,Robert Louis Stevenson,3.83,1416500294,9.78E+12,eng,245,5967,276,6/1/2005,Simon & Schuster
298,Treasure Island,Robert Louis Stevenson/N.C. Wyeth/Timothy Meis,3.83,689854684,9.78E+12,eng,64,104,14,7/1/2003,Atheneum Books for Young Readers
299,Treasure Island,Robert Louis Stevenson/Milo Winter,3.83,517221144,9.78E+12,en-US,272,56,4,9/3/2002,Gramercy Books
302,Treasure Island (Great Illustrated Classics),Deidre S. Laiken/A.J. McAllister/Robert Louis Stevenson,4.05,1577658051,9.78E+12,eng,232,91,16,1/31/2006,Abdo Publishing Company
313,100 Years of Lynchings,Ralph Ginzburg,4.61,933121180,9.78E+12,eng,270,88,4,11/22/1996,Black Classic Press
324,Cien años de soledad,Gabriel Garrquez,4.07,785950109,9.78E+12,spa,448,63,7,1/1/1990,French & European
330,On Beyond Zebra!,Dr. Seuss,4.04,394800842,9.78E+12,eng,64,2815,164,9/12/1955,Random House Books for Young Readers
332,The Wedding Clause,Debbie Raleigh,3.6,821778250,9.78E+12,eng,256,95,13,6/7/2005,Zebra
333,The Zebra Wall,Kevin Henkes,3.44,60733039,9.78E+12,eng,147,217,24,2/15/2005,Greenwillow Books
337,El perfume: Historia de un asesino,Patrick Süskind,4.02,8432216062,9.79E+12,spa,239,4136,255,6/1/2002,Booket
348,The Door Into Summer,Robert A. Heinlein,4.01,345413997,9.78E+12,eng,304,17232,649,6/17/1997,Del Rey
350,Stranger in a Strange Land,Robert A. Heinlein,3.92,441788386,9.78E+12,eng,528,251872,6241,10/1/1991,Ace
354,To Sail Beyond the Sunset,Robert A. Heinlein,3.87,441748600,9.78E+12,en-US,434,10293,193,6/1/1988,Ace Books
355,Job: A Comedy of Justice,Robert A. Heinlein,3.78,345316509,9.78E+12,en-US,439,15970,438,10/12/1985,Del Rey
356,Time for the Stars (Heinlein's Juveniles  #10),Robert A. Heinlein,3.97,765314932,9.78E+12,eng,256,6898,200,8/8/2006,Tor Books
357,The Long Dark Tea-Time of the Soul (Dirk Gently  #2),Douglas Adams,4.06,671742515,9.78E+12,en-US,307,67803,1401,2/15/1991,Pocket Books
359,The Salmon of Doubt (Dirk Gently  #3),Douglas Adams,3.93,345455290,9.78E+12,eng,298,22091,746,4/26/2005,Del Rey
362,Wish You Were Here: The Official Biography of Douglas Adams,Nick  Webb,4.14,345476514,9.78E+12,eng,368,2623,49,12/27/2005,Del Rey
367,Douglas Adams's Starship Titanic,Terry Jones,3.6,345368436,9.78E+12,eng,256,885,84,10/27/1998,Ballantine Books
377,Salmon of Doubt: Hitchhiking the Galaxy One Last Time,Douglas Adams/Christopher Cerf,3.93,1417622857,9.78E+12,eng,336,5,0,7/1/2003,Turtleback Books
382,The Phantom Tollbooth: A Children's Play in Two Acts,Susan Nanus/Norton Juster,4.13,573650969,9.78E+12,eng,72,100,13,1/12/2011,Samuel French  Inc.
385,On Bullshit,Harry G. Frankfurt,3.57,691122946,9.78E+12,eng,67,9358,995,1/30/2005,Princeton University Press
386,Another Bullshit Night in Suck City,Nick Flynn,3.78,393329402,9.78E+12,eng,347,9318,907,9/12/2005,W. W. Norton & Company
394,Lincoln at Gettysburg: The Words That Remade America,Garry Wills,4.14,671867423,9.78E+12,en-US,317,120,15,6/12/1993,Simon & Schuster
397,The Gettysburg Address,Abraham Lincoln/Michael McCurdy,4.53,395883970,9.78E+12,eng,32,5239,76,2/2/1998,HMH Books for Young Readers
399,Underworld,Don DeLillo,3.92,684848155,9.78E+12,eng,827,1505,175,7/9/1998,Scribner
400,Libra,Don DeLillo,3.99,140156046,9.78E+12,eng,480,11857,564,5/1/1991,Penguin
403,Americana,Don DeLillo,3.43,140119485,9.78E+12,eng,377,393,55,7/6/1989,Penguin Books
404,Running Dog,Don DeLillo,3.43,679722947,9.78E+12,eng,256,1356,72,7/17/1989,Vintage Contemporaries
406,Cosmopolis,Don DeLillo,3.22,743244257,9.78E+12,eng,224,460,41,4/6/2004,Scribner
407,Great Jones Street,Don DeLillo,3.48,140179178,9.78E+12,eng,272,2492,145,1/1/1994,Penguin Books
408,The Names,Don DeLillo,3.64,679722955,9.78E+12,eng,339,3100,212,7/17/1989,Vintage
409,Against the Day,Thomas Pynchon,4.13,159420120X,9.78E+12,eng,1085,5296,587,11/21/2006,Penguin Press
410,V.,Thomas Pynchon,3.96,60930217,9.78E+12,eng,547,1415,177,7/5/2005,Harper Perennial Modern Classics
411,The Crying of Lot 49,Thomas Pynchon,3.69,60931671,9.78E+12,eng,152,2161,230,4/1/1999,Harper Perennial
412,Gravity's Rainbow,Thomas Pynchon,4.01,140283382,9.78E+12,eng,784,762,213,1/1/2000,Penguin Books
413,Mason & Dixon,Thomas Pynchon/Christophe Claro/Brice Matthieussent,4.07,312423209,9.78E+12,eng,773,8086,602,1/3/2004,Picador USA
414,Vineland,Thomas Pynchon,3.69,141180633,9.78E+12,en-US,385,702,69,9/1/1997,Penguin Classics
415,Gravity's Rainbow,Thomas Pynchon,4.01,143039946,9.78E+12,eng,776,29764,2164,10/31/2006,Penguin Books
416,Slow Learner: Early Stories,Thomas Pynchon,3.5,316724432,9.78E+12,eng,193,334,34,4/30/1985,Back Bay Books
418,Been Down So Long It Looks Like Up To Me,Richard FariThomas Pynchon,3.8,140189300,9.78E+12,eng,352,2473,220,8/29/1996,Penguin Classics
420,The Year of Magical Thinking,Joan Didion,3.89,140004314X,9.78E+12,en-US,227,2656,336,10/4/2005,Knopf Publishing Group
421,The White Album,Joan Didion,4.17,374522219,9.78E+12,eng,222,11889,738,10/1/1990,Farrar Straus Giroux
422,A Book of Common Prayer,Joan Didion,3.8,679754865,9.78E+12,eng,272,2962,255,4/11/1995,Vintage International
423,Where I Was From,Joan Didion,3.86,679752862,9.78E+12,eng,240,2842,292,9/14/2004,Vintage
424,Slouching Towards Bethlehem,Joan Didion,4.21,374521727,9.78E+12,eng,238,26934,1825,10/1/1990,Farrar Straus Giroux
425,Democracy,Joan Didion,3.81,679754857,9.78E+12,en-US,234,2070,169,4/25/1995,Vintage International
426,We Tell Ourselves Stories in Order to Live: Collected Nonfiction,Joan Didion/John Leonard,4.5,307264874,9.78E+12,eng,1122,1564,108,10/17/2006,Everyman's Library
428,Play It As It Lays,Joan Didion/David Thomson,3.87,374529949,9.78E+12,eng,231,23656,1706,11/15/2005,Farrar  Straus and Giroux
431,The New York Trilogy,Paul Auster/Art Spiegelman/Luc Sante,3.89,143039830,9.78E+12,eng,308,43200,1873,3/28/2006,Penguin Classics
432,City of Glass (The New York Trilogy  #1),Paul Auster,3.79,140097317,9.78E+12,eng,203,12410,734,4/7/1987,Penguin Books
434,Ghosts (The New York Trilogy  #2),Paul Auster,3.64,014009735X,9.78E+12,eng,96,3672,195,7/7/1987,Penguin Books
435,The Locked Room (The New York Trilogy  #3),Paul Auster,3.89,940650762,9.78E+12,eng,179,2998,164,11/1/1986,Sun and Moon Press
444,Pyramids of Montauk: Explorations in Consciousness,Peter Moon/Preston B. Nichols/Nina Helms,3.89,963188925,9.78E+12,eng,256,74,2,1/1/1995,Sky Books (NY)
446,The Brooklyn Follies,Paul Auster,3.84,312426232,9.78E+12,eng,306,17977,1157,10/17/2006,Picador
447,Moon Palace,Paul Auster,3.94,140115854,9.78E+12,eng,320,16099,503,4/1/1990,Penguin Books
453,The Music of Chance,Paul Auster,3.9,140154078,9.78E+12,en-US,217,361,36,12/1/1991,Penguin Books
454,Travels in the Scriptorium,Paul Auster,3.23,805081453,9.78E+12,eng,145,6688,562,1/23/2007,Henry Holt & Company
456,Leviathan,Paul Auster,3.96,140178139,9.78E+12,eng,275,11744,443,9/1/1993,Penguin Books
463,The Red Notebook: True Stories,Paul Auster,3.77,811214982,9.78E+12,eng,104,2390,120,6/17/2002,New Directions
466,Timbuktu / Leviathan / Moon Palace,Paul Auster,4.38,2742741461,9.78E+12,fre,1075,21,1,11/7/2002,Actes Sud
